category,url,redirects,title,lt,description,ld,weight,featured,new,product-title,product-description,product-price,feature-age,feature-size,feature-time,related,product-video
razvivayushie-igry,puzzle-robot,,Крутящийся пазл из фетра Робот,30,"Пазл из крутящихся дисков с изображением робота. Диски несъемные, расположены друг над другом ""пирамидкой"" и закреплены металлической заклепкой. ",145,2,0,0,"Пазл ""Робот""","Пазл из крутящихся дисков с изображением робота. Диски несъемные, расположены друг над другом ""пирамидкой"" и закреплены металлической заклепкой. ",1100,от 2-х лет,21х21 см,4-6 дн,,https://youtu.be/7ZNstNFfSKE
razvivayushie-igry,puzzle-ptichka,https://kiddy-trick.ru/razvivayushie-igry/pazl-ptichka,Крутящийся пазл из фетра Птичка,31,"Пазл из крутящихся дисков с изображением птички. Диски несъемные, закреплены металлической заклепкой. ",102,3,0,0,"Пазл ""Птичка""","Пазл из крутящихся дисков с изображением птички. Диски несъемные, закреплены металлической заклепкой. ",800,от 2-х лет,21х21 см,3-5 дн,,
razvivayushie-igry,puzzle-yasherka,https://kiddy-trick.ru/razvivayushie-igry/pazl-yasherka,Крутящийся пазл из фетра Ящерка,31,Пазл состоит из 4 съемных вращающихся дисков. Диски фиксируются к основе магнитными кнопками,92,4,0,0,"Пазл ""Ящерка""",Пазл состоит из 4 съемных вращающихся дисков. Диски фиксируются к основе магнитными кнопками,800,от 2-х лет,21х21 см,3-5 дн,,
razvivayushie-igry,zastezhka-krokodil,https://kiddy-trick.ru/razvivayushie-igry/igrushka-krokodil-zastezhka,Мягкая игрушка с застежками Крокодил,36,"Мягкая игрушка состоит из 5 частей, соединяющихся различными застежками (пуговицы, кнопки, карабины, текстильная липучка, шнуровка). В кармашке на молнии прячется маленький крокодиленок.",186,5,1,0,"Игрушка-застежка ""Крокодил""","Мягкая игрушка состоит из 5 частей, соединяющихся различными застежками. Всего в игрушке 5 видов застежек: пуговицы, кнопки, карабины, текстильная липучка, шнуровка, а также присутствует кармашек на молнии. В кармашке прячется маленький крокодиленок. ",1500,от 2-х лет,78х15 см в собранном виде,5-7 дн,,
razvivayushie-igry,zastezhka-drakon,https://kiddy-trick.ru/razvivayushie-igry/igrushka-kitayskiy-drakon,Мягкая игрушка с застежками Дракон,34,"С мягкой игрушкой в виде дракона можно потренироваться застегивать пуговицы, кнопки, ремешки и фастексы, а также поиграть с липучкой и шнуровкой.",145,6,0,1,"Игрушка-застежка ""Дракон""","С мягкой игрушкой в виде дракона можно потренироваться застегивать пуговицы, кнопки, ремешки и фастексы, а также поиграть с липучкой и шнуровкой.",1500,от 2-х лет,50х30 см в собранном виде,5-7 дн,,
razvivayushie-igry,zastezhka-letuchaya-mysh,https://kiddy-trick.ru/razvivayushie-igry/igrushka-zastezhka-letuchaya-myshka,Мягкая игрушка с застежками Летучая мышь,40,"Мягкая игрушка для изучения застежек. Флисовая летучая мышь соединяется с ""кусочком"" неба фастексами. К диску с помощью пуговицы, магнитной кнопки и шнуровки крепятся звездочка, мышка-малышка и луна.",199,7,0,0,"Игрушка-застежка ""Летучая мышь""","Мягкая игрушка для изучения застежек. Флисовая летучая мышь соединяется с круглым ""кусочком"" неба фастексами. К диску с помощью пуговицы, магнитной кнопки и шнуровки крепятся звездочка, мышка-малышка и луна. ",1100,от 2-х лет,32х30 см в собранном виде и с расправленными крыльями,4-6 дн,,https://youtu.be/sC137eDwFTs
razvivayushie-igry,zastezhka-pautina,https://kiddy-trick.ru/razvivayushie-igry/igrushka-zastezhka-pautinka,Игрушка с застежками Паутина,28,"Игрушка представляет собой паутину-пирамидку, состоящую из 3 частей. Части соединяются текстильной липучкой и пуговицами. Паучок фиксируется на паутине с помощью кнопок, летучая мышка - шнурком.",194,8,0,0,"Игрушка-застежка ""Паутина""","Игрушка представляет собой паутину-пирамидку, состоящую из 3 частей. Части соединяются текстильной липучкой и пуговицами. Пальчиковый паучок фиксируется на паутине с помощью кнопок, летучая мышка - шнурком.",700,от 2-х лет,20х18 см,3-5 дн,,
razvivayushie-igry,krestiki-noliki-kosmos,https://kiddy-trick.ru/razvivayushie-igry/krestiki-noliki-kosmos,Игра крестики-нолики из фетра Космос ,37,"В данной игре вместо классических крестиков и ноликов используются ракеты и летающие тарелки. В ракеты и тарелки вшиты магнитики, которыми они крепятся к игровому полю.",168,9,0,0,"Крестики-нолики ""Космос""","В данной игре вместо классических крестиков и ноликов используются ракеты и летающие тарелки. В ракеты и тарелки вшиты магнитики, которыми они крепятся к игровому полю. С помощью шнуровки и нескольких космических деталей можно потренировать мелкую моторику.",1200,от 3-х лет,20х18 см,5-7 дн,,
razvivayushie-igry,schetnye-kartochki,https://kiddy-trick.ru/razvivayushie-igry/razvivayushie-kartochki-schet-1-5;https://kiddy-trick.ru/razvivayushie-igry/razvivayushie-kartochki-schet-6-10,Счетные карточки из фетра,25,Интерактивные карточки для счета от 1 до 10.,44,10,0,0,Счетные карточки,Интерактивные карточки для счета от 1 до 10.,3000,от 2-х лет,17х17 см,14-21 дн,,
razvivayushie-igry,palchikoviy-teatr-poezd,,Пальчиковый театр из фетра Поезд,32,"Радужный поезд из фетра - это разборная игрушка. Вагоны соединяются друг с другом различными застежками. Рассаживая зверят по вагончикам, можно рассказать ребенку, что едят животные.",182,11,0,0,"Пальчиковый театр ""Поезд""","Радужный поезд из фетра - это разборная игрушка. Вагоны соединяются друг с другом различными застежками, такими как: пуговка, фастекс, кнопка, магнит, липучка, шнуровка и ремешок. Рассаживая зверят по вагончикам, можно рассказать ребенку, что едят животные. ",1800,от 2-х лет,8х8 см (размер вагона),7-9 дн,,
razvivayushie-igry,palchikoviy-teatr-skazki,,Пальчиковый театр из фетра Сказки,33,"Набор состоит из домика, 12 пальчиковых персонажей (дедушка, бабушка, внучка, курочка, кошка, собака, мышка, лягушка, зайчик, лисичка, волк и медведь),  колобка, репки и двух яиц.",179,12,0,0,"Пальчиковый театр ""Сказки""","Набор состоит из домика, 12 пальчиковых персонажей (дедушка, бабушка, внучка, курочка, кошка, собака, мышка, лягушка, зайчик, лисичка, волк и медведь),  колобка, репки и двух яиц. Набор персонажей позволит обыграть такие сказки, как Репка, Колобок, Теремок и Курочка ряба.",1300,от 2-х лет,14х14 см (размер домика),7-9 дн,,
razvivayushie-igry,palchikoviy-teatr-zhivotnie,https://kiddy-trick.ru/razvivayushie-igry/palchikoviy-teatr-bolshoy,Пальчиковый театр из фетра Животные,35,Набор состоит из 35 пальчиковых животных из фетра. К набору прилагается специальная сумка для хранения.,103,13,0,0,"Пальчиковый театр ""Животные"" 35 шт",Набор состоит из 35 пальчиковых животных из фетра. К набору прилагается специальная сумка для хранения.,3400,от 2-х лет,"6х7,5 см (размер лисички) ",18-25 дн,,
razvivayushie-igry,nabor-ovoshi-mini,,Набор овощей из фетра 17 шт,27,"Набор состоит из 17 двусторонних фруктов-овощей из фетра. Одна сторона показывает как выглядят овощи снаружи, вторая - как выглядят внутри.",139,14,0,0,"Набор ""Овощи"" 17 шт","Набор состоит из 17 двусторонних фруктов-овощей из фетра. Одна сторона показывает как выглядят овощи снаружи, вторая - как выглядят внутри.  

**Список овощей**: (арбуз,баклажан, банан, виноград, гриб, груша, капуста, картошка, лимон, лук, морковка, огурец, перец, помидор, свекла, тыква, яблоко)",1600,от 1 года ,7х7 см (размер помидора),5-8 дн,,
razvivayushie-igry,nabor-ovoshi-full,https://kiddy-trick.ru/razvivayushie-igry/fruktovo-ovoshnoy-nabor,Набор овощей из фетра 36 шт,27,"Набор из 36 двусторонних фруктов-овощей из фетра. Одна сторона показывает как выглядят овощи снаружи, вторая - как выглядят внутри.",131,15,0,0,"Набор ""Овощи"" 36 шт","Набор двусторонних фруктов-овощей из фетра. Одна сторона показывает как выглядят овощи снаружи, вторая - как выглядят внутри.  

**Список овощей**: абрикос, апельсин, арбуз, баклажан, банан, брокколи, горошек, грейпфрут, груша, дыня, ежевика, земляника, кабачок, капуста, картошка, киви, клубника, кокос, кукуруза, лимон, лук, малина, манго, морковь, облепиха, огурец, персик, помидор, репа, свекла, слива, тыква, хурма, черника, чеснок, яблоко)",3200,от 1 года ,7х7 см (размер помидора),14-21 дн,,
razvivayushie-igry,soberi-lico,https://kiddy-trick.ru/razvivayushie-igry/igra-soberi-lico,Игра из фетра Собери лицо,25,"Веселая игра из фетра, в которой ребенку предстоит собрать лицо из частей. Съемные детали на липучках позволят собрать от 12 и больше различных портретов.",154,16,0,0,"Игра ""Собери Лицо""","Веселая игра из фетра, в которой ребенку предстоит собрать лицо из частей. Съемные глаза, носы, рты, брови и прически позволят собрать от 12 и больше различных портретов, а аксессуары дополнят картину. Все детали крепятся к лицу липучками. Игра представляет собой планшет из 3 страниц - игровой центральной страницы и двух боковых из велкроткани, на которых хранятся мелкие детали. Для причесок в планшет вшит карман на молнии. К игре прилагается карточка с примерами портретов.",2800,от 2-х лет,23х65 см (в развернутом виде),9-14 дн,,
razvivayushie-igry,kartochki-zastezhki,,Карточки из фетра Застежки,26,Набор фетровых страниц для тренировки моторики с помощью различных застежек.,76,17,0,1,"Карточки ""Застежки""",Набор фетровых страниц для тренировки моторики с помощью различных застежек.,2500,от 2-х лет,21х21 см,7-14 дн,,
razvivayushie-igry,kovrik,https://kiddy-trick.ru/razvivayushie-igry/igrovoy-kovrik-cvetochek,Мягкий развивающий коврик,25,"С развивающим ковриком ребенка можно развлечь не только дома и на природе, но и в поездке - он разборный и мягкий. Выполнен в виде цветка с серединкой, на которую можно посадить малыша.",185,18,0,0,Развивающий коврик,"С нашим ковриком можно развлечь ребенка не только дома и на природе, но и в поездке - он разборный и мягкий. Выполнен в виде цветка с серединкой, на которую можно посадить малыша. Лепестки содержат различные игровые элементы из фетра:

- овощи-фрукты покажут как выглядят яблоко, груша, апельсин и помидор снаружи и внутри;
- геометрические фигуры выполнены из разных фактурный тканей и продемонстрируют шесть видов эмоций;
- букашки и листочки для изучения цветов радуги;
- игра в прятки с подсолнухом и забором;
- кораблик, в который можно сложить морских обитателей;
- грибочек развлечет поиском спрятанных насекомых и улиток.

Части коврика скрепляются кнопками. Коврик складывается гармошкой и фиксируется застежкой.",11500,от 1 года,102х108 см (размер лепестка: 34х38 см),21-28 дн,,https://youtu.be/8nsapl3l7ms